{
 "benchmark": "refund-decision",
 "cases": [
  {
   "expected": "review",
   "id": "uci-f-00ced06ee96dca7aff053020",
   "inputSha256": "513ab496209654506b02905c767e018402fd24f05bef8340c0c4eb008a5f2da0",
   "inputs": {
    "customer": {
     "priorRefunds": 18,
     "tier": "enterprise"
    },
    "order": {
     "ageDays": 0,
     "status": "paid",
     "total": 127.7
    }
   },
   "origin": "independent-judge"
  },
  {
   "expected": "approve",
   "id": "uci-f-00f90a697560793ca6c4e126",
   "inputSha256": "49f96cd2786d1b9ea78f5d26aac7e8b75f78d25b56e390275e2168e9229d33d8",
   "inputs": {
    "customer": {
     "priorRefunds": 3,
     "tier": "enterprise"
    },
    "order": {
     "ageDays": 1,
     "status": "paid",
     "total": 471.98
    }
   },
   "origin": "independent-judge"
  },
  {
   "expected": "approve",
   "id": "uci-f-00fcd08ec3a811cccf2e6b44",
   "inputSha256": "eab3f1ec6ebebe728ed900cfdade5d042fd41c5430912fffc0b0e0fc157f2c26",
   "inputs": {
    "customer": {
     "priorRefunds": 0,
     "tier": "enterprise"
    },
    "order": {
     "ageDays": 7,
     "status": "paid",
     "total": 247.9
    }
   },
   "origin": "independent-judge"
  },
  {
   "expected": "approve",
   "id": "uci-f-0102fb5e23908862425679ea",
   "inputSha256": "236e76c92fed4dafbe8e641e24e8c58d111a9954b8e303ca763b5e2bba091b7a",
   "inputs": {
    "customer": {
     "priorRefunds": 0,
     "tier": "enterprise"
    },
    "order": {
     "ageDays": 12,
     "status": "paid",
     "total": 167.75
    }
   },
   "origin": "independent-judge"
  },
  {
   "expected": "review",
   "id": "uci-f-01063b311d731718d913c1b0",
   "inputSha256": "f3fc397d2882bd2409c52316dbb69e4523ca82e7876fa3566131962c6d5cfac2",
   "inputs": {
    "customer": {
     "priorRefunds": 6,
     "tier": "enterprise"
    },
    "order": {
     "ageDays": 0,
     "status": "paid",
     "total": 1733.5
    }
   },
   "origin": "independent-judge"
  },
  {
   "expected": "review",
   "id": "uci-f-0118a559d24e7365d2350114",
   "inputSha256": "eff6c1d81fc0a0d38bd6e6353ead4f457b6d305b1ac01aa51efbd4ac73ac679c",
   "inputs": {
    "customer": {
     "priorRefunds": 2,
     "tier": "enterprise"
    },
    "order": {
     "ageDays": 19,
     "status": "fraudulent",
     "total": 403.2
    }
   },
   "origin": "independent-judge"
  },
  {
   "expected": "approve",
   "id": "uci-f-011a27d0d8b3340153ed477c",
   "inputSha256": "e8fbb6a60b72b23a47a4a66ee0d2c5b23d073cb5aef6c2987cc3b7a34a818f99",
   "inputs": {
    "customer": {
     "priorRefunds": 2,
     "tier": "enterprise"
    },
    "order": {
     "ageDays": 3,
     "status": "paid",
     "total": 310.48
    }
   },
   "origin": "independent-judge"
  },
  {
   "expected": "approve",
   "id": "uci-f-012d6274ca6f5c44406fe126",
   "inputSha256": "60fd6770ec117e45d1f54daeafc0defd5008290d65e7a60d6b7a5316f6cbffad",
   "inputs": {
    "customer": {
     "priorRefunds": 4,
     "tier": "enterprise"
    },
    "order": {
     "ageDays": 15,
     "status": "paid",
     "total": 518.12
    }
   },
   "origin": "independent-judge"
  },
  {
   "expected": "review",
   "id": "uci-f-01631f04a0019d26be94b989",
   "inputSha256": "070c8c60f1dc3b1a06d8852b4a9f5fbe3240ed35922908e3d850229b18b4c7bb",
   "inputs": {
    "customer": {
     "priorRefunds": 20,
     "tier": "enterprise"
    },
    "order": {
     "ageDays": 4,
     "status": "paid",
     "total": 5162.74
    }
   },
   "origin": "independent-judge"
  },
  {
   "expected": "review",
   "id": "uci-f-0166247a8c5ce3c9f1f3f5a6",
   "inputSha256": "963be37a52ce34d2d77d6ea36dac80ababe60705f8d513fbfac6cef0136378e2",
   "inputs": {
    "customer": {
     "priorRefunds": 14,
     "tier": "enterprise"
    },
    "order": {
     "ageDays": 5,
     "status": "paid",
     "total": 262.55
    }
   },
   "origin": "independent-judge"
  },
  {
   "expected": "review",
   "id": "uci-f-01685d20435a4f5ee616d554",
   "inputSha256": "b2f8e999d2e695bf1d90f09aea7082f3a2a3b8830e5e70c59d9c2199d215c286",
   "inputs": {
    "customer": {
     "priorRefunds": 2,
     "tier": "enterprise"
    },
    "order": {
     "ageDays": 1,
     "status": "fraudulent",
     "total": 233.39
    }
   },
   "origin": "independent-judge"
  },
  {
   "expected": "approve",
   "id": "uci-f-0171730cb5e4b26315e24113",
   "inputSha256": "2bb0f11531e983988970dc844d349e2076c0960f73aa8dffa71697bc04b8a4db",
   "inputs": {
    "customer": {
     "priorRefunds": 1,
     "tier": "enterprise"
    },
    "order": {
     "ageDays": 0,
     "status": "paid",
     "total": 112.47
    }
   },
   "origin": "independent-judge"
  },
  {
   "expected": "approve",
   "id": "uci-f-0188600670e922271ff24bff",
   "inputSha256": "27c6ef9453e4f322a645146bd6d1a4232eef45ec47e21ae5d3be0651eb173539",
   "inputs": {
    "customer": {
     "priorRefunds": 1,
     "tier": "enterprise"
    },
    "order": {
     "ageDays": 9,
     "status": "paid",
     "total": 6.75
    }
   },
   "origin": "independent-judge"
  },
  {
   "expected": "review",
   "id": "uci-f-019c369052343383753f41e3",
   "inputSha256": "692c528262762d5bd514814d6132e678398e69e7b62aab2087f1dd02c7d2bb82",
   "inputs": {
    "customer": {
     "priorRefunds": 1,
     "tier": "enterprise"
    },
    "order": {
     "ageDays": 0,
     "status": "fraudulent",
     "total": 686.22
    }
   },
   "origin": "independent-judge"
  },
  {
   "expected": "review",
   "id": "uci-f-01a9fa0e614e8339bc9a94b2",
   "inputSha256": "832d3272d711475a0d511566d704903ad051f83fb99c8f645e47f17a5e49decc",
   "inputs": {
    "customer": {
     "priorRefunds": 3,
     "tier": "enterprise"
    },
    "order": {
     "ageDays": 3,
     "status": "fraudulent",
     "total": 122.46
    }
   },
   "origin": "independent-judge"
  },
  {
   "expected": "review",
   "id": "uci-f-01b2ae27093874a818dbd562",
   "inputSha256": "48f4741ac6386ff73a473c5e7b04551858a484575a331281dfcbb2fe08692edd",
   "inputs": {
    "customer": {
     "priorRefunds": 1,
     "tier": "enterprise"
    },
    "order": {
     "ageDays": 3,
     "status": "fraudulent",
     "total": 342.09
    }
   },
   "origin": "independent-judge"
  },
  {
   "expected": "approve",
   "id": "uci-f-01c7cb21db260d2652d9972d",
   "inputSha256": "56453b9a2555231ff9eb0f000e8cf0768e0329c053d9ae1f7add6ea9d446a48f",
   "inputs": {
    "customer": {
     "priorRefunds": 0,
     "tier": "standard"
    },
    "order": {
     "ageDays": 4,
     "status": "paid",
     "total": 405.0
    }
   },
   "origin": "independent-judge"
  },
  {
   "expected": "approve",
   "id": "uci-f-01d66e9fc04b26273cf5adea",
   "inputSha256": "292d563bb5541a864900938ba4762edbae52410a1ee2a2055f6da120d0118972",
   "inputs": {
    "customer": {
     "priorRefunds": 1,
     "tier": "enterprise"
    },
    "order": {
     "ageDays": 0,
     "status": "paid",
     "total": 3.95
    }
   },
   "origin": "independent-judge"
  },
  {
   "expected": "approve",
   "id": "uci-f-01d6ceba63dc300d37e05e30",
   "inputSha256": "ca657c02c08845184119f23fbbb44690bb923f52fd67854034c3682f72dad9a4",
   "inputs": {
    "customer": {
     "priorRefunds": 1,
     "tier": "standard"
    },
    "order": {
     "ageDays": 6,
     "status": "paid",
     "total": 332.16
    }
   },
   "origin": "independent-judge"
  },
  {
   "expected": "review",
   "id": "uci-f-01ddaafe017dab8679c0460e",
   "inputSha256": "12a1e801bc39d2c726d8da905120b58a2a8ba0f56fb413095cc61e3c6a7f251e",
   "inputs": {
    "customer": {
     "priorRefunds": 5,
     "tier": "enterprise"
    },
    "order": {
     "ageDays": 8,
     "status": "paid",
     "total": 472.5
    }
   },
   "origin": "independent-judge"
  },
  {
   "expected": "approve",
   "id": "uci-f-01dea008892f99df3e6ab78e",
   "inputSha256": "9146715890e44bff0dcdba40344b4ed2d5902347322c1175dc42d7aedc6cfe6a",
   "inputs": {
    "customer": {
     "priorRefunds": 1,
     "tier": "enterprise"
    },
    "order": {
     "ageDays": 9,
     "status": "paid",
     "total": 558.59
    }
   },
   "origin": "independent-judge"
  },
  {
   "expected": "review",
   "id": "uci-f-01e2fd58f9a32aac0ef31259",
   "inputSha256": "229fd55010d222dbc6cc4450932f140a0b23db379d8c1d8d84336a1e79663323",
   "inputs": {
    "customer": {
     "priorRefunds": 2,
     "tier": "enterprise"
    },
    "order": {
     "ageDays": 6,
     "status": "fraudulent",
     "total": 541.71
    }
   },
   "origin": "independent-judge"
  },
  {
   "expected": "approve",
   "id": "uci-f-01f0f7b47af89245c9b06bb4",
   "inputSha256": "d173de3de40ff9ea538da6ab4f499b88100a2b573badc6527d793effdde1d626",
   "inputs": {
    "customer": {
     "priorRefunds": 2,
     "tier": "enterprise"
    },
    "order": {
     "ageDays": 0,
     "status": "paid",
     "total": 534.0
    }
   },
   "origin": "independent-judge"
  },
  {
   "expected": "review",
   "id": "uci-f-01fce4fd296a3034e5aabe57",
   "inputSha256": "b1d3516d19d9f5ecc61edbeb9592c87cb0911dbe2c92aad52d32e589def16d5b",
   "inputs": {
    "customer": {
     "priorRefunds": 0,
     "tier": "enterprise"
    },
    "order": {
     "ageDays": 0,
     "status": "fraudulent",
     "total": 251.68
    }
   },
   "origin": "independent-judge"
  },
  {
   "expected": "approve",
   "id": "uci-f-0205a39d0072b5866469cf0f",
   "inputSha256": "bf65fdf7038e354211929cc561f272e9890f6ba3df54fe820c47056c91db21f7",
   "inputs": {
    "customer": {
     "priorRefunds": 2,
     "tier": "enterprise"
    },
    "order": {
     "ageDays": 4,
     "status": "paid",
     "total": 203.8
    }
   },
   "origin": "independent-judge"
  },
  {
   "expected": "approve",
   "id": "uci-f-021367bb085f1f87da34e6ce",
   "inputSha256": "20eb2ea97f26897f08ac74c99019eb70d4ec99a04041ab5d92a49a6eafe3f1cc",
   "inputs": {
    "customer": {
     "priorRefunds": 2,
     "tier": "enterprise"
    },
    "order": {
     "ageDays": 22,
     "status": "paid",
     "total": 19.95
    }
   },
   "origin": "independent-judge"
  },
  {
   "expected": "review",
   "id": "uci-f-0217a0b63f35e7f1a593c157",